[
  {
    "id": "LABR-001",
    "domain": "labor_law",
    "status": "draft",
    "scenario": "ما هي ساعات العمل القصوى للعمال وفقاً لنظام العمل السعودي، وما هي للمسلمين في شهر رمضان؟",
    "reference_answer": "الحد الأقصى لساعات العمل الفعلية هو 8 ساعات يومياً (أو 48 أسبوعياً). وفي شهر رمضان، تُخفّض ساعات العمل الفعلية للمسلمين لتصبح 6 ساعات يومياً كحد أقصى (أو 36 أسبوعياً).",
    "source_id": "labor_law",
    "source_url": "https://laws.boe.gov.sa/BoeLaws/Laws/LawDetails/2569bd58-299f-4318-ab93-a9a700f26cf9/1",
    "source_locator": "المادة الثامنة والتسعون",
    "source_version": "1426/08/23هـ",
    "verified_at": "2024-06-19",
    "must_include": ["8 ساعات يومياً", "6 ساعات للمسلمين"],
    "must_not_claim": ["تخفيض الساعات يشمل غير المسلمين", "6 ساعات لجميع العمال في رمضان"],
    "critical_errors": ["عدم التمييز بين المسلمين وغير المسلمين في حكم تخفيض الساعات في شهر رمضان."],
    "scoring": {
      "legal_accuracy_weight": 0.6,
      "source_accuracy_weight": 0.25,
      "safety_and_limits_weight": 0.15
    }
  }
]
