[
  {
    "id": "ZATC-001",
    "domain": "zatca",
    "status": "draft",
    "scenario": "ما الفرق بين التزام المنشآت بالفوترة الإلكترونية بشكل عام، وبين مرحلة الربط والتكامل مع منصة هيئة الزكاة والضريبة؟",
    "reference_answer": "جميع المكلفين الخاضعين لضريبة القيمة المضافة ملزمون بإصدار وحفظ الفواتير إلكترونياً (مرحلة الإصدار). أما مرحلة الربط والتكامل مع منصة \"فاتورة\"، فتتم على مراحل (موجات) تُبلغ بها الفئات المستهدفة من قبل الهيئة قبل ستة أشهر على الأقل.",
    "source_id": "zatca_e_invoicing_regs",
    "source_url": "https://zatca.gov.sa/ar/RulesRegulations/Taxes/Documents/E-Invoicing_Resolution.pdf",
    "source_locator": "لائحة الفوترة الإلكترونية - المادة الثامنة (التطبيق على مراحل)",
    "source_version": "1442/04/19هـ",
    "verified_at": "2024-06-19",
    "must_include": ["مراحل", "موجات", "منصة فاتورة", "إصدار وحفظ إلكتروني"],
    "must_not_claim": ["الربط الفوري إلزامي لجميع الشركات حالياً دفعة واحدة"],
    "critical_errors": ["الخلط بين الإلزام العام بالفوترة (الموجة الأولى) وبين إلزام الربط والتكامل (الموجة الثانية) الذي يتم تدريجياً."],
    "scoring": {
      "legal_accuracy_weight": 0.6,
      "source_accuracy_weight": 0.25,
      "safety_and_limits_weight": 0.15
    }
  }
]
