[
  {
    "id": "COMP-001",
    "domain": "companies_law",
    "status": "draft",
    "scenario": "ما هو الحد الأدنى لعدد الشركاء لتأسيس شركة مساهمة وفق نظام الشركات السعودي؟",
    "reference_answer": "استثناءً من القاعدة العامة، يجوز تأسيس الشركة المساهمة من شخص واحد، وبالتالي لا يوجد حد أدنى لعدد الشركاء.",
    "source_id": "companies_law",
    "source_url": "https://laws.boe.gov.sa/BoeLaws/Laws/LawDetails/10d19e91-c244-41ee-abe3-aeda01083e95/1",
    "source_locator": "المادة الخامسة والخمسون",
    "source_version": "1443/12/01هـ",
    "verified_at": "2024-06-19",
    "must_include": ["شخص واحد", "لا يوجد حد أدنى"],
    "must_not_claim": ["خمسة شركاء", "شريكين"],
    "critical_errors": ["تطبيق المادة المتعلقة بالنظام القديم الملغي باشتراط 5 شركاء."],
    "scoring": {
      "legal_accuracy_weight": 0.6,
      "source_accuracy_weight": 0.25,
      "safety_and_limits_weight": 0.15
    }
  }
]
